<?xml version="1.0" encoding="UTF-8"?>
<update xmlns:xsi="http://www.w3.org/2001/XMLSchema-instance" xsi:noNamespaceSchemaLocation="http://www.ofw.fi/xml/2011/java-xmldb-updater/UpdaterSchema.xsd">
  
  <alterTables>
    <table name="CourseBase">
      <addFields>
        <field name="maxParticipantCount" type="java.lang.Long" nullable="true" unique="false" />
      </addFields>
    </table>

    <table name="Course">
      <addFields>
        <field name="enrolmentTimeEnd" type="Types.TIMESTAMP" nullable="true" unique="false" />
      </addFields>
    </table>
  </alterTables>

</update>