<?xml version="1.0" encoding="UTF-8"?>
<update xmlns:xsi="http://www.w3.org/2001/XMLSchema-instance" xsi:noNamespaceSchemaLocation="http://www.ofw.fi/xml/2010/pyramus/UpdaterSchema.xsd">
  
  <alterTables>
    <table name="StudyProgrammeCategory">
      <addFields>
        <field name="educationType" type="java.lang.Integer" nullable="true" unique="false" />
      </addFields>
      <addForeignKeys>
        <key columns="educationType" referencedColumns="id" referencedTable="EducationType"/>
      </addForeignKeys>
    </table>

    <table name="Subject">
      <addFields>
        <field name="educationType" type="java.lang.Integer" nullable="true" unique="false" />
      </addFields>
      <addForeignKeys>
        <key columns="educationType" referencedColumns="id" referencedTable="EducationType"/>
      </addForeignKeys>
    </table>
  </alterTables>

</update>