<?xml version="1.0" encoding="UTF-8"?>
<update xmlns:xsi="http://www.w3.org/2001/XMLSchema-instance" xsi:noNamespaceSchemaLocation="http://www.ofw.fi/xml/2011/java-xmldb-updater/UpdaterSchema.xsd">
  
  <createTables>
    <table name="CourseDescriptionCategory" primaryKeys="id">
      <fields>
        <field name="id" type="java.lang.Long" nullable="false" unique="true"/>
        <field name="name" type="java.lang.String" length="255" nullable="false"/>
        <field name="archived" type="java.lang.Boolean" nullable="false" unique="false" />
      </fields>
    </table>
    
    <table name="CourseDescription" primaryKeys="id">
      <fields>
        <field name="id" type="java.lang.Long" nullable="false" unique="true"/>
        <field name="courseBase" type="java.lang.Long"/>
        <field name="category" type="java.lang.Long"/>
        <field name="description" type="java.lang.String" length="2147483647"/>
      </fields>
      <foreignKeys>
        <key columns="courseBase" referencedColumns="id" referencedTable="CourseBase"/>
        <key columns="category" referencedColumns="id" referencedTable="CourseDescriptionCategory"/>
      </foreignKeys>
    </table>
  </createTables>
</update>