<?xml version="1.0" encoding="UTF-8"?>
<update xmlns:xsi="http://www.w3.org/2001/XMLSchema-instance" xsi:noNamespaceSchemaLocation="http://www.ofw.fi/xml/2011/java-xmldb-updater/UpdaterSchema.xsd">

  <createTables>
    <table name="CreditLink" primaryKeys="id">
      <fields>
        <field name="id" type="java.lang.Long" nullable="false" unique="false" />

        <field name="credit" type="java.lang.Long" nullable="false" unique="false" />
        <field name="student" type="java.lang.Long" nullable="true" unique="false" />

        <field name="archived" type="java.lang.Boolean" nullable="false" unique="false" />
        <field name="created" type="Types.TIMESTAMP" nullable="false" unique="false" />
        <field name="creator" type="java.lang.Long" nullable="true" unique="false" />
      </fields>
    </table>
  </createTables>

  <alterTables>
    <table name="CreditLink">
      <addForeignKeys>
        <key columns="credit" referencedColumns="id" referencedTable="Credit" />
        <key columns="student" referencedColumns="id" referencedTable="Student" />
        <key columns="creator" referencedColumns="id" referencedTable="User" />
      </addForeignKeys>
    </table>
  </alterTables>

</update>
