<?xml version="1.0" encoding="UTF-8"?>
<update xmlns:xsi="http://www.w3.org/2001/XMLSchema-instance" xsi:noNamespaceSchemaLocation="http://www.ofw.fi/xml/2011/java-xmldb-updater/UpdaterSchema.xsd">
  
  <createTables>
    <table name="StudentContactLogEntryComment" primaryKeys="id">
      <fields>
        <field name="entry" type="java.lang.Long" nullable="false" unique="false" />
        <field name="commentDate" type="Types.TIMESTAMP" nullable="true" unique="false" />
        <field name="text" type="java.lang.String" nullable="true" unique="false" />
        <field name="id" type="java.lang.Long" nullable="false" unique="false" />
        <field name="archived" type="java.lang.Boolean" nullable="false" unique="false" />
        <field name="creatorName" type="java.lang.String" nullable="true" unique="false" />
        <field name="version" type="java.lang.Long" nullable="false" unique="false" />
      </fields>

      <foreignKeys>
        <key columns="entry" referencedColumns="id" referencedTable="StudentContactLogEntry" />
      </foreignKeys>
    </table>
  </createTables>
</update>