<?xml version="1.0" encoding="UTF-8"?>
<update xmlns:xsi="http://www.w3.org/2001/XMLSchema-instance" xsi:noNamespaceSchemaLocation="http://www.ofw.fi/xml/2011/java-xmldb-updater/UpdaterSchema.xsd">

  <createTables>
    <table name="CourseStudentVariable" primaryKeys="id">
      <fields>
        <field name="courseStudent" type="java.lang.Long" nullable="true" unique="false" />
        <field name="id" type="java.lang.Long" nullable="false" unique="true" />
        <field name="value" type="java.lang.String" length="1073741824" nullable="true" unique="false" />
        <field name="variableKey" type="java.lang.Long" nullable="true" unique="false" />
        <field name="version" type="java.lang.Long" nullable="false" unique="false" />
      </fields>
      <foreignKeys>
        <key columns="courseStudent" referencedColumns="id" referencedTable="CourseStudent" />
        <key columns="variableKey" referencedColumns="id" referencedTable="CourseStudentVariableKey" />
      </foreignKeys>
    </table>
    <table name="CourseStudentVariableKey" primaryKeys="id">
      <fields>
        <field name="variableName" type="java.lang.String" nullable="false" unique="false" />
        <field name="id" type="java.lang.Long" nullable="false" unique="true" />
        <field name="variableType" type="java.lang.String" nullable="true" unique="false" />
        <field name="userEditable" type="java.lang.Boolean" nullable="false" unique="false" />
        <field name="variableKey" type="java.lang.String" nullable="false" unique="false" />
        <field name="version" type="java.lang.Long" nullable="false" unique="false" />
      </fields>
    </table>
  </createTables>
</update>